{"canonical_dgaf_efficacy":"NOT_ESTABLISHED","custody_class":"SAME_SYSTEM_NONINDEPENDENT","dataset_lock_commit_sha":"e7ba2fe6fc6b3587957c59231da81ae107cacab2","dataset_lock_receipt_sha256":"f31c1b464b7f37833ecdbf40c393720931e56ffbdee5163794a2b8b19bec2843","dataset_lock_record_id":"E002-DATASET-LOCK-A16973BD7AA9E1EB","durable_retention":{"class":"LOCAL_CUSTODY_ARCHIVE","id":"epoch002-materialization-20260918"},"epoch":2,"epoch_001_pooling_allowed":false,"epoch_004_substitution_allowed":false,"evidence_execution_class":"OPERATOR_CODESPACE","evidence_tooling_commit_sha":"84e3a9ca5af8f87f63c14b06de8aa21430542ada","high_assurance_authorized":false,"historical_pooling_allowed":false,"independent_custody":false,"materialization_evidence_status":"MATERIALIZATION_PASS_PENDING_REPOSITORY_RECEIPT","materialization_manifest_sha256":"f52f8d37312eb97cdd5bfada2140bc79b9bf5ef63a6250b7e71778436eaeb6ee","materialization_sidecar_sha256":"73a6750e3aa39275ebb39b62dd5b765aa9b24e98902b3982c5f2f593a94000c0","materialized_input_sha256":"b6bfe8e356084993f096398fd2a9ca3427fdaf15a5e55b70f764a688e407e937","materializer_blob_sha":"3a825b026423952c2844cb18664eb6395b72fdc1","materializer_commit_sha":"cf32a62bbf08a1b8db39709f4989be1be800d64e","materializer_path":"scripts/materialize_track_a_epoch_002_unblinded_input.py","operator_execution_receipt_sha256":"f0460199a20b52bad6323434d7be184506213e302d44a8b9f583242c87f2f832","outcome_aggregation_performed":false,"paired_seed_units":50,"primary_analysis_authorized":false,"primary_analysis_run":false,"protected_artifact":{"archive_sha256":"a40bb53d9c24a6afd996222ab3b275c2385b90245f9b2bb3d942291b104b85cb","ciphertext_sha256":"bbce92721b350b18eb287c0a95dc21365c9b1a061b324af8da2133a922db861f","custody_certificate_public_key_der_sha256":"53d0b2a95b2634ef7011b808657e693df426dcaecf8ad70c8094be20d37c4f08","custody_certificate_sha256":"5d14c89c20e0d22586045dea9fbb5de9a7ec6e7bbe7be4cd5b4da3ce9693db4e","name":"track-a-epoch-002-protected-encrypted","plaintext_tar_sha256":"cf5ac4531810fb96cc418c5f4c33d60b748cefc1b13d4fc50b49834afc85085e","size_bytes":143360},"protocol_id":"PDMAL-TRACK-A-TOPOLOGY-ROBUSTNESS-EPOCH-002","public_artifact":{"archive_sha256":"60f6df2ca67cbf46cf1a7d3537f0ac1c5f5ab3602a15ce0cfbb7162ab9d5215e","manifest_sha256":"d76b1a028dfa57a197c2e0b2108127bf9d6ae8d3755377b19fbae93b7bea0e0b","name":"track-a-epoch-002-public-blinded","size_bytes":860160},"record_count":2250,"record_type":"TRACK_A_EPOCH_002_MATERIALIZATION_EVIDENCE","schema_version":1,"scientific_n_increment":0,"secret_material_persisted":false,"structure_validation":"PASS","unblinding_decision_commit_sha":"bf6279b9989f211e324ff3e9012788bed95e5c84","unblinding_decision_record_id":"E002-UNBLINDING-AD773A5A1B2CB233","unblinding_decision_sha256":"43c16bda206d2f68519ea45c5c4c67c95ba8296fcc78e5f034b6be72a324a288"}
